{
  "schema_version": 1,
  "run_id": "CLAWO-AUTOLOOP-DURABLE-RECOVERY-TRUST-RECOVERY-R1",
  "case_id": "preparation-validator",
  "requirement_ids": [
    "HARNESS-VALIDATION"
  ],
  "subject_kind": "candidate",
  "base": "2694c0babcf16030278e58d829a7c71bcaa0f7a2",
  "head": "53fc41f2b1215dc7e7f788435ae53d3380e65d85",
  "tree": "ea3a247f08e305e58ac101b142615ecb7d228f5c",
  "frozen": false,
  "input_manifest": {
    "path": "inputs.json",
    "sha256": "dba67957fd6c219216529874743b943f6fb53599624c199c528efa2debe6057e"
  },
  "harness_sha256": "9c687affbaa2119c137aac9d235c206d492e89655dbb2b2567b2514ac2a4dbf9",
  "dependency_sha256": "6a0b75434f1c1afc5b70dc34a2b97216c0d9f81b6de9372bc6541a240eb4f8b4",
  "tool_sha256": "c4fb07b925ea1ffde7a29e305d3f91e66f5e53799e269cf024a720c934e3dbb3",
  "patch": {
    "path": "inputs.patch",
    "sha256": "ff7a43a30771d85f3869ace3668a3ebd31593a397135cc0f5d12fab3f3537c81"
  },
  "test_sources": [
    {
      "path": "evidence.schema.json",
      "sha256": "a53353ec75ca9e24a51eca8a5988a878f5f8fc31b79d68227b43da05d2d679ec"
    },
    {
      "path": "collect.mjs",
      "sha256": "908432dc4392495b53385109268a41dc0b1eb4307679b28056934440190864aa"
    },
    {
      "path": "verify.mjs",
      "sha256": "90832febd2085f9b7a69a797f0f5cede97ac946e1191f7bc0e0e31309434425f"
    },
    {
      "path": "verify.test.mjs",
      "sha256": "a638c688e494e243482248a9b795f64bb3918f164aadd690d9cb5781067b8006"
    }
  ],
  "source_imports": [
    {
      "path": "/home/openclaw/workspace/projects/claw-orchestrator-autoloop-durable-recovery/scripts/autoloop-trust-recovery/verify.test.mjs",
      "sha256": "a638c688e494e243482248a9b795f64bb3918f164aadd690d9cb5781067b8006",
      "observation_id": "source-0"
    },
    {
      "path": "/home/openclaw/workspace/projects/claw-orchestrator-autoloop-durable-recovery/scripts/autoloop-trust-recovery/verify.mjs",
      "sha256": "90832febd2085f9b7a69a797f0f5cede97ac946e1191f7bc0e0e31309434425f",
      "observation_id": "source-1"
    },
    {
      "path": "/home/openclaw/workspace/projects/claw-orchestrator-autoloop-durable-recovery/scripts/autoloop-trust-recovery/collect.mjs",
      "sha256": "908432dc4392495b53385109268a41dc0b1eb4307679b28056934440190864aa",
      "observation_id": "source-2"
    }
  ],
  "executions": [
    {
      "id": "validator-6a0487f1-ae07-4d08-9057-633188e830f2",
      "argv": [
        "rtk",
        "proxy",
        "node",
        "--test",
        "--test-reporter=tap",
        "scripts/autoloop-trust-recovery/verify.test.mjs"
      ],
      "cwd": "/home/openclaw/workspace/projects/claw-orchestrator-autoloop-durable-recovery/",
      "started_at": "2026-09-14T01:49:03.957Z",
      "ended_at": "2026-09-14T01:49:04.253Z",
      "process_id": 61,
      "exit_code": 0,
      "signal": null,
      "timed_out": false,
      "spawn_error": null,
      "stdout": {
        "path": "validator-6a0487f1-ae07-4d08-9057-633188e830f2.stdout.txt",
        "sha256": "37dab332663a9096c2c0da85142c56f881a5951371cfc16d603d38a2d18225a7"
      },
      "stderr": {
        "path": "validator-6a0487f1-ae07-4d08-9057-633188e830f2.stderr.txt",
        "sha256": "e3b0c44298fc1c149afbf4c8996fb92427ae41e4649b934ca495991b7852b855"
      },
      "report": {
        "path": "validator-6a0487f1-ae07-4d08-9057-633188e830f2.stdout.txt",
        "sha256": "37dab332663a9096c2c0da85142c56f881a5951371cfc16d603d38a2d18225a7"
      },
      "report_format": "node-tap",
      "discovered_test_ids": [
        "recomputes digest, durable event order and row count from referenced bytes",
        "rejects fabricated invariant booleans",
        "rejects missing artifacts",
        "rejects changed artifact hashes",
        "rejects wrong subject kind",
        "rejects wrong candidate head",
        "rejects wrong input manifest",
        "rejects hidden process failure",
        "rejects a recorded spawn error with exit zero",
        "rejects success without an observed process",
        "rejects a terminating signal",
        "rejects a timeout",
        "rejects zero selected tests",
        "rejects required skips",
        "rejects fabricated parsed values",
        "rejects reordered observation declarations",
        "rejects fabricated event sequence",
        "rejects a missing fault observation",
        "rejects removed predicates",
        "rejects weakened row-count predicate",
        "rejects Coder-authored review claims",
        "rejects unrecorded dirty test bytes",
        "rejects missing RED patch",
        "rejects an unfrozen snapshot relabeled as frozen",
        "rejects substituted RED patch bytes",
        "rejects substituted test source bytes",
        "rejects incorrect command identity",
        "rejects duplicate execution identity",
        "rejects unknown observation execution",
        "rejects fabricated observer identity",
        "rejects out-of-run path traversal",
        "rejects absolute artifact paths",
        "rejects symlinked artifacts even when their target has the expected bytes",
        "a recomputed hash cannot hide a failed test in raw TAP",
        "a green report cannot hide a failed raw stdout stream",
        "rejects cancellation and unhandled errors even with exit zero",
        "recomputes predicates after both the event bytes and declared values change",
        "detects source import misattribution from the import receipt",
        "refuses synthetic booleans as fixed literal predicates",
        "accepts only complete ordered repetitions with distinct execution identities",
        "reads a JSON event from an exact byte range and rejects an invalid range",
        "collector retains real child stdout, stderr, argv, cwd, exit and test inventory",
        "collector kills its timed-out process and retains its terminating signal",
        "collector preserves spawn failure rather than inventing a successful process",
        "collector redacts known credential forms and records the applied rules",
        "collector refuses overwrites and output paths outside the run artifact root before spawning",
        "collector cannot use a symlink to redirect output into a protected directory",
        "collector rejects unknown groups and refuses heavy groups without a frozen candidate",
        "requires an independent contract instead of inferring acceptance from a bundle",
        "validates literal, equality and byte-preserving prefix predicates against event values",
        "validates Vitest inventory and rejects hidden failures even when success remains true",
        "a green Vitest report cannot hide a failing test in raw stdout"
      ],
      "executed_test_ids": [
        "recomputes digest, durable event order and row count from referenced bytes",
        "rejects fabricated invariant booleans",
        "rejects missing artifacts",
        "rejects changed artifact hashes",
        "rejects wrong subject kind",
        "rejects wrong candidate head",
        "rejects wrong input manifest",
        "rejects hidden process failure",
        "rejects a recorded spawn error with exit zero",
        "rejects success without an observed process",
        "rejects a terminating signal",
        "rejects a timeout",
        "rejects zero selected tests",
        "rejects required skips",
        "rejects fabricated parsed values",
        "rejects reordered observation declarations",
        "rejects fabricated event sequence",
        "rejects a missing fault observation",
        "rejects removed predicates",
        "rejects weakened row-count predicate",
        "rejects Coder-authored review claims",
        "rejects unrecorded dirty test bytes",
        "rejects missing RED patch",
        "rejects an unfrozen snapshot relabeled as frozen",
        "rejects substituted RED patch bytes",
        "rejects substituted test source bytes",
        "rejects incorrect command identity",
        "rejects duplicate execution identity",
        "rejects unknown observation execution",
        "rejects fabricated observer identity",
        "rejects out-of-run path traversal",
        "rejects absolute artifact paths",
        "rejects symlinked artifacts even when their target has the expected bytes",
        "a recomputed hash cannot hide a failed test in raw TAP",
        "a green report cannot hide a failed raw stdout stream",
        "rejects cancellation and unhandled errors even with exit zero",
        "recomputes predicates after both the event bytes and declared values change",
        "detects source import misattribution from the import receipt",
        "refuses synthetic booleans as fixed literal predicates",
        "accepts only complete ordered repetitions with distinct execution identities",
        "reads a JSON event from an exact byte range and rejects an invalid range",
        "collector retains real child stdout, stderr, argv, cwd, exit and test inventory",
        "collector kills its timed-out process and retains its terminating signal",
        "collector preserves spawn failure rather than inventing a successful process",
        "collector redacts known credential forms and records the applied rules",
        "collector refuses overwrites and output paths outside the run artifact root before spawning",
        "collector cannot use a symlink to redirect output into a protected directory",
        "collector rejects unknown groups and refuses heavy groups without a frozen candidate",
        "requires an independent contract instead of inferring acceptance from a bundle",
        "validates literal, equality and byte-preserving prefix predicates against event values",
        "validates Vitest inventory and rejects hidden failures even when success remains true",
        "a green Vitest report cannot hide a failing test in raw stdout"
      ],
      "skipped_test_ids": [],
      "redactions": []
    }
  ],
  "observations": [
    {
      "id": "source-0",
      "artifact": {